Sheet: Sheet1
A1: http://www.antarctica.ac.uk/met/READER/upper_air/
A2: Amundsen_scott 00Z 500hPa temperature
A4: Year | B4: Jan | C4: Feb | D4: Mar | E4: Apr | F4: May | G4: Jun | H4: Jul | I4: Aug | J4: Sep | K4: Oct | L4: Nov | M4: Dec | N4: Year | O4: Jan | P4: Feb | Q4: Mar | R4: Apr | S4: May | T4: Jun | U4: Jul | V4: Aug | W4: Sep | X4: Oct | Y4: Nov | Z4: Dec
A5: 1961 | B5: -36.1( 87) | C5: -36.6(100) | D5: -41.0(100) | E5: -40.6(100) | F5: -40.9(100) | G5: -41.5(100) | H5: -46.4( 96) | I5: -44.1( 83) | J5: -42.9( 93) | K5: -42.2( 96) | L5: -39.1( 93) | M5: -39.1(100) | N5: 1961 | O5: of:=VALUE(LEFT([.B5];5)) -> -36.1 | P5: of:=VALUE(LEFT([.C5];5)) -> -36.6 | Q5: of:=VALUE(LEFT([.D5];5)) -> -41 | R5: of:=VALUE(LEFT([.E5];5)) -> -40.6 | S5: of:=VALUE(LEFT([.F5];5)) -> -40.9 | T5: of:=VALUE(LEFT([.G5];5)) -> -41.5 | U5: of:=VALUE(LEFT([.H5];5)) -> -46.4 | V5: of:=VALUE(LEFT([.I5];5)) -> -44.1 | W5: of:=VALUE(LEFT([.J5];5)) -> -42.9 | X5: of:=VALUE(LEFT([.K5];5)) -> -42.2 | Y5: of:=VALUE(LEFT([.L5];5)) -> -39.1 | Z5: of:=VALUE(LEFT([.M5];5)) -> -39.1
A6: 1962 | B6: -37.1(100) | C6: -37.2(100) | D6: -41.7( 96) | E6: -41.5(100) | F6: -42.7( 96) | G6: -43.1( 93) | H6: -45.7(100) | I6: -45.4(100) | J6: -43.4( 86) | K6: -43.0(100) | L6: -39.8( 96) | M6: -38.5(100) | N6: 1962 | O6: of:=VALUE(LEFT([.B6];5)) -> -37.1 | P6: of:=VALUE(LEFT([.C6];5)) -> -37.2 | Q6: of:=VALUE(LEFT([.D6];5)) -> -41.7 | R6: of:=VALUE(LEFT([.E6];5)) -> -41.5 | S6: of:=VALUE(LEFT([.F6];5)) -> -42.7 | T6: of:=VALUE(LEFT([.G6];5)) -> -43.1 | U6: of:=VALUE(LEFT([.H6];5)) -> -45.7 | V6: of:=VALUE(LEFT([.I6];5)) -> -45.4 | W6: of:=VALUE(LEFT([.J6];5)) -> -43.4 | X6: of:=VALUE(LEFT([.K6];5)) -> -43 | Y6: of:=VALUE(LEFT([.L6];5)) -> -39.8 | Z6: of:=VALUE(LEFT([.M6];5)) -> -38.5
A7: 1963 | B7: -35.3( 93) | C7: -38.4(100) | D7: -40.5( 96) | E7: -43.4(100) | F7: -43.0( 90) | G7: -42.1( 93) | H7: -44.0( 93) | I7: -44.2( 83) | J7: -43.6( 93) | K7: -42.8(100) | L7: -40.5(100) | M7: -36.8( 67) | N7: 1963 | O7: of:=VALUE(LEFT([.B7];5)) -> -35.3 | P7: of:=VALUE(LEFT([.C7];5)) -> -38.4 | Q7: of:=VALUE(LEFT([.D7];5)) -> -40.5 | R7: of:=VALUE(LEFT([.E7];5)) -> -43.4 | S7: of:=VALUE(LEFT([.F7];5)) -> -43 | T7: of:=VALUE(LEFT([.G7];5)) -> -42.1 | U7: of:=VALUE(LEFT([.H7];5)) -> -44 | V7: of:=VALUE(LEFT([.I7];5)) -> -44.2 | W7: of:=VALUE(LEFT([.J7];5)) -> -43.6 | X7: of:=VALUE(LEFT([.K7];5)) -> -42.8 | Y7: of:=VALUE(LEFT([.L7];5)) -> -40.5 | Z7: of:=VALUE(LEFT([.M7];5)) -> -36.8
A8: 1964 | B8: -35.3( 93) | C8: -38.4(100) | D8: -41.5(100) | E8: -43.8( 96) | F8: -47.1( 90) | G8: -42.9( 93) | H8: -43.4(100) | I8: -46.0( 96) | J8: -45.3( 93) | K8: -43.2(100) | L8: -40.1( 96) | M8: -37.9( 93) | N8: 1964 | O8: of:=VALUE(LEFT([.B8];5)) -> -35.3 | P8: of:=VALUE(LEFT([.C8];5)) -> -38.4 | Q8: of:=VALUE(LEFT([.D8];5)) -> -41.5 | R8: of:=VALUE(LEFT([.E8];5)) -> -43.8 | S8: of:=VALUE(LEFT([.F8];5)) -> -47.1 | T8: of:=VALUE(LEFT([.G8];5)) -> -42.9 | U8: of:=VALUE(LEFT([.H8];5)) -> -43.4 | V8: of:=VALUE(LEFT([.I8];5)) -> -46 | W8: of:=VALUE(LEFT([.J8];5)) -> -45.3 | X8: of:=VALUE(LEFT([.K8];5)) -> -43.2 | Y8: of:=VALUE(LEFT([.L8];5)) -> -40.1 | Z8: of:=VALUE(LEFT([.M8];5)) -> -37.9
A9: 1964 | B9: -35.3( 93) | C9: -38.4(100) | D9: -41.5(100) | E9: -43.8( 96) | F9: -47.1( 90) | G9: -42.9( 93) | H9: -43.4(100) | I9: -46.0( 96) | J9: -45.3( 93) | K9: -43.2(100) | L9: -40.1( 96) | M9: -37.9( 93) | N9: 1964 | O9: of:=VALUE(LEFT([.B9];5)) -> -35.3 | P9: of:=VALUE(LEFT([.C9];5)) -> -38.4 | Q9: of:=VALUE(LEFT([.D9];5)) -> -41.5 | R9: of:=VALUE(LEFT([.E9];5)) -> -43.8 | S9: of:=VALUE(LEFT([.F9];5)) -> -47.1 | T9: of:=VALUE(LEFT([.G9];5)) -> -42.9 | U9: of:=VALUE(LEFT([.H9];5)) -> -43.4 | V9: of:=VALUE(LEFT([.I9];5)) -> -46 | W9: of:=VALUE(LEFT([.J9];5)) -> -45.3 | X9: of:=VALUE(LEFT([.K9];5)) -> -43.2 | Y9: of:=VALUE(LEFT([.L9];5)) -> -40.1 | Z9: of:=VALUE(LEFT([.M9];5)) -> -37.9
A10: 1965 | B10: -36.8( 29) | C10: -36.7(100) | D10: -40.5( 93) | E10: -41.5( 93) | F10: -44.1( 93) | G10: -43.8( 93) | H10: -44.8( 90) | I10: -44.9( 93) | J10: -45.5( 93) | K10: -42.1(100) | L10: -40.1( 96) | M10: -36.6( 96) | N10: 1965 | O10: of:=VALUE(LEFT([.B10];5)) -> -36.8 | P10: of:=VALUE(LEFT([.C10];5)) -> -36.7 | Q10: of:=VALUE(LEFT([.D10];5)) -> -40.5 | R10: of:=VALUE(LEFT([.E10];5)) -> -41.5 | S10: of:=VALUE(LEFT([.F10];5)) -> -44.1 | T10: of:=VALUE(LEFT([.G10];5)) -> -43.8 | U10: of:=VALUE(LEFT([.H10];5)) -> -44.8 | V10: of:=VALUE(LEFT([.I10];5)) -> -44.9 | W10: of:=VALUE(LEFT([.J10];5)) -> -45.5 | X10: of:=VALUE(LEFT([.K10];5)) -> -42.1 | Y10: of:=VALUE(LEFT([.L10];5)) -> -40.1 | Z10: of:=VALUE(LEFT([.M10];5)) -> -36.6
A11: 1966 | B11: -35.6(100) | C11: -36.8( 57) | D11: -38.4( 70) | E11: -42.4( 66) | F11: -44.4( 70) | G11: -43.6( 90) | H11: -44.5( 87) | I11: -47.0( 83) | J11: -44.7( 73) | K11: -43.1(100) | L11: -38.6( 96) | M11: -35.1(100) | N11: 1966 | O11: of:=VALUE(LEFT([.B11];5)) -> -35.6 | P11: of:=VALUE(LEFT([.C11];5)) -> -36.8 | Q11: of:=VALUE(LEFT([.D11];5)) -> -38.4 | R11: of:=VALUE(LEFT([.E11];5)) -> -42.4 | S11: of:=VALUE(LEFT([.F11];5)) -> -44.4 | T11: of:=VALUE(LEFT([.G11];5)) -> -43.6 | U11: of:=VALUE(LEFT([.H11];5)) -> -44.5 | V11: of:=VALUE(LEFT([.I11];5)) -> -47 | W11: of:=VALUE(LEFT([.J11];5)) -> -44.7 | X11: of:=VALUE(LEFT([.K11];5)) -> -43.1 | Y11: of:=VALUE(LEFT([.L11];5)) -> -38.6 | Z11: of:=VALUE(LEFT([.M11];5)) -> -35.1
A12: 1967 | B12: -31.7( 93) | C12: -35.7(100) | D12: -41.4(100) | E12: -45.2(100) | F12: -42.1( 87) | G12: -42.8(100) | H12: -44.1(100) | I12: -44.1(100) | J12: -43.4( 93) | K12: -44.0( 96) | L12: -38.8(100) | M12: -35.6( 93) | N12: 1967 | O12: of:=VALUE(LEFT([.B12];5)) -> -31.7 | P12: of:=VALUE(LEFT([.C12];5)) -> -35.7 | Q12: of:=VALUE(LEFT([.D12];5)) -> -41.4 | R12: of:=VALUE(LEFT([.E12];5)) -> -45.2 | S12: of:=VALUE(LEFT([.F12];5)) -> -42.1 | T12: of:=VALUE(LEFT([.G12];5)) -> -42.8 | U12: of:=VALUE(LEFT([.H12];5)) -> -44.1 | V12: of:=VALUE(LEFT([.I12];5)) -> -44.1 | W12: of:=VALUE(LEFT([.J12];5)) -> -43.4 | X12: of:=VALUE(LEFT([.K12];5)) -> -44 | Y12: of:=VALUE(LEFT([.L12];5)) -> -38.8 | Z12: of:=VALUE(LEFT([.M12];5)) -> -35.6
A13: 1968 | B13: -35.7( 90) | C13: -36.0( 96) | D13: -38.9(100) | E13: -41.4(100) | F13: -42.9( 96) | G13: -45.2(100) | H13: -44.4( 96) | I13: -45.7(100) | J13: -46.8(100) | K13: -40.6(100) | L13: -38.8(100) | M13: -37.5( 93) | N13: 1968 | O13: of:=VALUE(LEFT([.B13];5)) -> -35.7 | P13: of:=VALUE(LEFT([.C13];5)) -> -36 | Q13: of:=VALUE(LEFT([.D13];5)) -> -38.9 | R13: of:=VALUE(LEFT([.E13];5)) -> -41.4 | S13: of:=VALUE(LEFT([.F13];5)) -> -42.9 | T13: of:=VALUE(LEFT([.G13];5)) -> -45.2 | U13: of:=VALUE(LEFT([.H13];5)) -> -44.4 | V13: of:=VALUE(LEFT([.I13];5)) -> -45.7 | W13: of:=VALUE(LEFT([.J13];5)) -> -46.8 | X13: of:=VALUE(LEFT([.K13];5)) -> -40.6 | Y13: of:=VALUE(LEFT([.L13];5)) -> -38.8 | Z13: of:=VALUE(LEFT([.M13];5)) -> -37.5
A14: 1969 | B14: -35.2(100) | C14: -39.5( 85) | D14: -41.2(100) | E14: -41.2( 96) | F14: -42.4(100) | G14: -44.9( 93) | H14: -47.7( 96) | I14: -45.5(100) | J14: -43.8(100) | K14: -40.5( 96) | L14: -40.3( 93) | M14: -37.2(100) | N14: 1969 | O14: of:=VALUE(LEFT([.B14];5)) -> -35.2 | P14: of:=VALUE(LEFT([.C14];5)) -> -39.5 | Q14: of:=VALUE(LEFT([.D14];5)) -> -41.2 | R14: of:=VALUE(LEFT([.E14];5)) -> -41.2 | S14: of:=VALUE(LEFT([.F14];5)) -> -42.4 | T14: of:=VALUE(LEFT([.G14];5)) -> -44.9 | U14: of:=VALUE(LEFT([.H14];5)) -> -47.7 | V14: of:=VALUE(LEFT([.I14];5)) -> -45.5 | W14: of:=VALUE(LEFT([.J14];5)) -> -43.8 | X14: of:=VALUE(LEFT([.K14];5)) -> -40.5 | Y14: of:=VALUE(LEFT([.L14];5)) -> -40.3 | Z14: of:=VALUE(LEFT([.M14];5)) -> -37.2
A15: 1970 | B15: -33.9( 96) | C15: -37.4( 89) | D15: -40.8( 48) | E15: -41.3( 50) | F15: -45.0( 45) | G15: -43.1( 40) | H15: -44.2( 48) | I15: -47.2( 45) | J15: -44.2( 73) | K15: -40.8( 80) | L15: -40.6(100) | M15: -36.3(100) | N15: 1970 | O15: of:=VALUE(LEFT([.B15];5)) -> -33.9 | P15: of:=VALUE(LEFT([.C15];5)) -> -37.4 | Q15: of:=VALUE(LEFT([.D15];5)) -> -40.8 | R15: of:=VALUE(LEFT([.E15];5)) -> -41.3 | S15: of:=VALUE(LEFT([.F15];5)) -> -45 | T15: of:=VALUE(LEFT([.G15];5)) -> -43.1 | U15: of:=VALUE(LEFT([.H15];5)) -> -44.2 | V15: of:=VALUE(LEFT([.I15];5)) -> -47.2 | W15: of:=VALUE(LEFT([.J15];5)) -> -44.2 | X15: of:=VALUE(LEFT([.K15];5)) -> -40.8 | Y15: of:=VALUE(LEFT([.L15];5)) -> -40.6 | Z15: of:=VALUE(LEFT([.M15];5)) -> -36.3
A16: 1971 | B16: -32.4( 93) | C16: -36.8(100) | D16: -39.9( 90) | E16: -40.6( 90) | F16: -42.0(100) | G16: -45.1(100) | H16: -45.8(100) | I16: -44.4( 96) | J16: -45.0( 96) | K16: -41.9(100) | L16: -38.4(100) | M16: -35.0( 93) | N16: 1971 | O16: of:=VALUE(LEFT([.B16];5)) -> -32.4 | P16: of:=VALUE(LEFT([.C16];5)) -> -36.8 | Q16: of:=VALUE(LEFT([.D16];5)) -> -39.9 | R16: of:=VALUE(LEFT([.E16];5)) -> -40.6 | S16: of:=VALUE(LEFT([.F16];5)) -> -42 | T16: of:=VALUE(LEFT([.G16];5)) -> -45.1 | U16: of:=VALUE(LEFT([.H16];5)) -> -45.8 | V16: of:=VALUE(LEFT([.I16];5)) -> -44.4 | W16: of:=VALUE(LEFT([.J16];5)) -> -45 | X16: of:=VALUE(LEFT([.K16];5)) -> -41.9 | Y16: of:=VALUE(LEFT([.L16];5)) -> -38.4 | Z16: of:=VALUE(LEFT([.M16];5)) -> -35
A17: 1972 | B17: -34.2( 96) | C17: -37.4( 96) | D17: -40.3(100) | E17: -42.9( 93) | F17: -42.4( 87) | G17: -43.1(100) | H17: -44.6(100) | I17: -42.8(100) | J17: -44.1( 96) | K17: -41.9( 96) | L17: -38.7( 93) | M17: -36.8( 93) | N17: 1972 | O17: of:=VALUE(LEFT([.B17];5)) -> -34.2 | P17: of:=VALUE(LEFT([.C17];5)) -> -37.4 | Q17: of:=VALUE(LEFT([.D17];5)) -> -40.3 | R17: of:=VALUE(LEFT([.E17];5)) -> -42.9 | S17: of:=VALUE(LEFT([.F17];5)) -> -42.4 | T17: of:=VALUE(LEFT([.G17];5)) -> -43.1 | U17: of:=VALUE(LEFT([.H17];5)) -> -44.6 | V17: of:=VALUE(LEFT([.I17];5)) -> -42.8 | W17: of:=VALUE(LEFT([.J17];5)) -> -44.1 | X17: of:=VALUE(LEFT([.K17];5)) -> -41.9 | Y17: of:=VALUE(LEFT([.L17];5)) -> -38.7 | Z17: of:=VALUE(LEFT([.M17];5)) -> -36.8
A18: 1973 | B18: -35.1( 93) | C18: -40.1( 96) | D18: -42.0( 80) | E18: -43.4( 83) | F18: -42.0( 90) | G18: -45.6( 86) | H18: -44.9( 93) | I18: -44.7( 93) | J18: -43.8( 90) | K18: -41.4( 83) | L18: -37.4( 90) | M18: -38.6( 90) | N18: 1973 | O18: of:=VALUE(LEFT([.B18];5)) -> -35.1 | P18: of:=VALUE(LEFT([.C18];5)) -> -40.1 | Q18: of:=VALUE(LEFT([.D18];5)) -> -42 | R18: of:=VALUE(LEFT([.E18];5)) -> -43.4 | S18: of:=VALUE(LEFT([.F18];5)) -> -42 | T18: of:=VALUE(LEFT([.G18];5)) -> -45.6 | U18: of:=VALUE(LEFT([.H18];5)) -> -44.9 | V18: of:=VALUE(LEFT([.I18];5)) -> -44.7 | W18: of:=VALUE(LEFT([.J18];5)) -> -43.8 | X18: of:=VALUE(LEFT([.K18];5)) -> -41.4 | Y18: of:=VALUE(LEFT([.L18];5)) -> -37.4 | Z18: of:=VALUE(LEFT([.M18];5)) -> -38.6
A19: 1974 | B19: -34.9( 96) | C19: -38.0( 96) | D19: -40.7( 96) | E19: -42.3( 96) | F19: -44.2( 96) | G19: -41.1( 93) | H19: -44.5(100) | I19: -44.6( 96) | J19: -44.4(100) | K19: -41.8(100) | L19: -38.1(100) | M19: -34.6( 61) | N19: 1974 | O19: of:=VALUE(LEFT([.B19];5)) -> -34.9 | P19: of:=VALUE(LEFT([.C19];5)) -> -38 | Q19: of:=VALUE(LEFT([.D19];5)) -> -40.7 | R19: of:=VALUE(LEFT([.E19];5)) -> -42.3 | S19: of:=VALUE(LEFT([.F19];5)) -> -44.2 | T19: of:=VALUE(LEFT([.G19];5)) -> -41.1 | U19: of:=VALUE(LEFT([.H19];5)) -> -44.5 | V19: of:=VALUE(LEFT([.I19];5)) -> -44.6 | W19: of:=VALUE(LEFT([.J19];5)) -> -44.4 | X19: of:=VALUE(LEFT([.K19];5)) -> -41.8 | Y19: of:=VALUE(LEFT([.L19];5)) -> -38.1 | Z19: of:=VALUE(LEFT([.M19];5)) -> -34.6
A20: 1975 | B20: -35.8(100) | C20: -35.7(100) | D20: -39.4(100) | E20: -42.3(100) | F20: -42.7(100) | G20: -45.3(100) | H20: -47.5(100) | I20: -45.9(100) | J20: -44.6(100) | K20: -43.0(100) | L20: -39.4( 93) | M20: -35.1( 90) | N20: 1975 | O20: of:=VALUE(LEFT([.B20];5)) -> -35.8 | P20: of:=VALUE(LEFT([.C20];5)) -> -35.7 | Q20: of:=VALUE(LEFT([.D20];5)) -> -39.4 | R20: of:=VALUE(LEFT([.E20];5)) -> -42.3 | S20: of:=VALUE(LEFT([.F20];5)) -> -42.7 | T20: of:=VALUE(LEFT([.G20];5)) -> -45.3 | U20: of:=VALUE(LEFT([.H20];5)) -> -47.5 | V20: of:=VALUE(LEFT([.I20];5)) -> -45.9 | W20: of:=VALUE(LEFT([.J20];5)) -> -44.6 | X20: of:=VALUE(LEFT([.K20];5)) -> -43 | Y20: of:=VALUE(LEFT([.L20];5)) -> -39.4 | Z20: of:=VALUE(LEFT([.M20];5)) -> -35.1
A21: 1976 | B21: -34.4(100) | C21: -36.8(100) | D21: -40.0(100) | E21: -43.7(100) | F21: -44.0(100) | G21: -44.2(100) | H21: -45.2(100) | I21: -45.5(100) | J21: -44.2(100) | K21: -45.9( 96) | L21: -40.2( 73) | M21: -34.4(100) | N21: 1976 | O21: of:=VALUE(LEFT([.B21];5)) -> -34.4 | P21: of:=VALUE(LEFT([.C21];5)) -> -36.8 | Q21: of:=VALUE(LEFT([.D21];5)) -> -40 | R21: of:=VALUE(LEFT([.E21];5)) -> -43.7 | S21: of:=VALUE(LEFT([.F21];5)) -> -44 | T21: of:=VALUE(LEFT([.G21];5)) -> -44.2 | U21: of:=VALUE(LEFT([.H21];5)) -> -45.2 | V21: of:=VALUE(LEFT([.I21];5)) -> -45.5 | W21: of:=VALUE(LEFT([.J21];5)) -> -44.2 | X21: of:=VALUE(LEFT([.K21];5)) -> -45.9 | Y21: of:=VALUE(LEFT([.L21];5)) -> -40.2 | Z21: of:=VALUE(LEFT([.M21];5)) -> -34.4
A22: 1977 | B22: -32.2(100) | C22: -38.3(100) | D22: -40.5(100) | E22: -42.7(100) | F22: -40.7(100) | G22: -43.1( 96) | H22: -44.5( 96) | I22: -44.4(100) | J22: -46.6(100) | K22: -43.9(100) | L22: -41.2(100) | M22: -38.2(100) | N22: 1977 | O22: of:=VALUE(LEFT([.B22];5)) -> -32.2 | P22: of:=VALUE(LEFT([.C22];5)) -> -38.3 | Q22: of:=VALUE(LEFT([.D22];5)) -> -40.5 | R22: of:=VALUE(LEFT([.E22];5)) -> -42.7 | S22: of:=VALUE(LEFT([.F22];5)) -> -40.7 | T22: of:=VALUE(LEFT([.G22];5)) -> -43.1 | U22: of:=VALUE(LEFT([.H22];5)) -> -44.5 | V22: of:=VALUE(LEFT([.I22];5)) -> -44.4 | W22: of:=VALUE(LEFT([.J22];5)) -> -46.6 | X22: of:=VALUE(LEFT([.K22];5)) -> -43.9 | Y22: of:=VALUE(LEFT([.L22];5)) -> -41.2 | Z22: of:=VALUE(LEFT([.M22];5)) -> -38.2
A23: 1978 | B23: -36.6(100) | C23: -36.8(100) | D23: -40.5(100) | E23: -40.7(100) | F23: -42.6(100) | G23: -43.9(100) | H23: -44.9(100) | I23: -47.0(100) | J23: -42.2(100) | K23: -41.6(100) | L23: -38.1(100) | M23: -35.4(100) | N23: 1978 | O23: of:=VALUE(LEFT([.B23];5)) -> -36.6 | P23: of:=VALUE(LEFT([.C23];5)) -> -36.8 | Q23: of:=VALUE(LEFT([.D23];5)) -> -40.5 | R23: of:=VALUE(LEFT([.E23];5)) -> -40.7 | S23: of:=VALUE(LEFT([.F23];5)) -> -42.6 | T23: of:=VALUE(LEFT([.G23];5)) -> -43.9 | U23: of:=VALUE(LEFT([.H23];5)) -> -44.9 | V23: of:=VALUE(LEFT([.I23];5)) -> -47 | W23: of:=VALUE(LEFT([.J23];5)) -> -42.2 | X23: of:=VALUE(LEFT([.K23];5)) -> -41.6 | Y23: of:=VALUE(LEFT([.L23];5)) -> -38.1 | Z23: of:=VALUE(LEFT([.M23];5)) -> -35.4
A24: 1979 | B24: -33.0(100) | C24: -36.8( 60) | D24: -37.6( 67) | E24: -38.1( 66) | F24: -43.1( 77) | G24: -42.1( 73) | H24: -44.8( 67) | I24: -46.1( 77) | J24: -42.8( 63) | K24: -42.8( 93) | L24: -38.7( 83) | M24: -36.0( 58) | N24: 1979 | O24: of:=VALUE(LEFT([.B24];5)) -> -33 | P24: of:=VALUE(LEFT([.C24];5)) -> -36.8 | Q24: of:=VALUE(LEFT([.D24];5)) -> -37.6 | R24: of:=VALUE(LEFT([.E24];5)) -> -38.1 | S24: of:=VALUE(LEFT([.F24];5)) -> -43.1 | T24: of:=VALUE(LEFT([.G24];5)) -> -42.1 | U24: of:=VALUE(LEFT([.H24];5)) -> -44.8 | V24: of:=VALUE(LEFT([.I24];5)) -> -46.1 | W24: of:=VALUE(LEFT([.J24];5)) -> -42.8 | X24: of:=VALUE(LEFT([.K24];5)) -> -42.8 | Y24: of:=VALUE(LEFT([.L24];5)) -> -38.7 | Z24: of:=VALUE(LEFT([.M24];5)) -> -36
A25: 1980 | B25: -33.9( 87) | C25: -36.0( 75) | D25: -40.4( 67) | E25: -41.0( 46) | F25: -41.1( 70) | G25: -42.4( 60) | H25: -44.0( 54) | I25: -42.7( 77) | J25: -41.9( 80) | K25: -41.7( 67) | L25: -36.5( 40) | M25: -35.6( 87) | N25: 1980 | O25: of:=VALUE(LEFT([.B25];5)) -> -33.9 | P25: of:=VALUE(LEFT([.C25];5)) -> -36 | Q25: of:=VALUE(LEFT([.D25];5)) -> -40.4 | R25: of:=VALUE(LEFT([.E25];5)) -> -41 | S25: of:=VALUE(LEFT([.F25];5)) -> -41.1 | T25: of:=VALUE(LEFT([.G25];5)) -> -42.4 | U25: of:=VALUE(LEFT([.H25];5)) -> -44 | V25: of:=VALUE(LEFT([.I25];5)) -> -42.7 | W25: of:=VALUE(LEFT([.J25];5)) -> -41.9 | X25: of:=VALUE(LEFT([.K25];5)) -> -41.7 | Y25: of:=VALUE(LEFT([.L25];5)) -> -36.5 | Z25: of:=VALUE(LEFT([.M25];5)) -> -35.6
A26: 1981 | B26: -33.8( 96) | C26: -35.9( 82) | D26: -36.8( 70) | E26: -43.0( 73) | F26: -40.1( 58) | G26: -43.7( 80) | H26: -41.8( 64) | I26: -42.0( 67) | J26: -44.0( 50) | K26: -40.3( 48) | L26: -39.4( 63) | M26: -33.5( 64) | N26: 1981 | O26: of:=VALUE(LEFT([.B26];5)) -> -33.8 | P26: of:=VALUE(LEFT([.C26];5)) -> -35.9 | Q26: of:=VALUE(LEFT([.D26];5)) -> -36.8 | R26: of:=VALUE(LEFT([.E26];5)) -> -43 | S26: of:=VALUE(LEFT([.F26];5)) -> -40.1 | T26: of:=VALUE(LEFT([.G26];5)) -> -43.7 | U26: of:=VALUE(LEFT([.H26];5)) -> -41.8 | V26: of:=VALUE(LEFT([.I26];5)) -> -42 | W26: of:=VALUE(LEFT([.J26];5)) -> -44 | X26: of:=VALUE(LEFT([.K26];5)) -> -40.3 | Y26: of:=VALUE(LEFT([.L26];5)) -> -39.4 | Z26: of:=VALUE(LEFT([.M26];5)) -> -33.5
A27: 1982 | B27: -33.9( 67) | C27: -36.6( 21) | D27: -43.4( 22) | E27: -40.2( 26) | F27: -42.6( 25) | G27: -44.6( 43) | H27: -45.8( 35) | I27: -44.4( 32) | J27: -44.2( 46) | K27: -43.7( 80) | L27: -34.3( 33) | M27: -35.6( 35) | N27: 1982 | O27: of:=VALUE(LEFT([.B27];5)) -> -33.9 | P27: of:=VALUE(LEFT([.C27];5)) -> -36.6 | Q27: of:=VALUE(LEFT([.D27];5)) -> -43.4 | R27: of:=VALUE(LEFT([.E27];5)) -> -40.2 | S27: of:=VALUE(LEFT([.F27];5)) -> -42.6 | T27: of:=VALUE(LEFT([.G27];5)) -> -44.6 | U27: of:=VALUE(LEFT([.H27];5)) -> -45.8 | V27: of:=VALUE(LEFT([.I27];5)) -> -44.4 | W27: of:=VALUE(LEFT([.J27];5)) -> -44.2 | X27: of:=VALUE(LEFT([.K27];5)) -> -43.7 | Y27: of:=VALUE(LEFT([.L27];5)) -> -34.3 | Z27: of:=VALUE(LEFT([.M27];5)) -> -35.6
A28: 1983 | B28: -35.5( 61) | C28: -38.6( 35) | D28: - | E28: -36.8( 13) | F28: -38.4( 61) | G28: -41.0( 43) | H28: -43.5( 32) | I28: -43.3( 22) | J28: - | K28: -42.9( 29) | L28: -39.0( 26) | M28: -35.5( 38) | N28: 1983 | O28: of:=VALUE(LEFT([.B28];5)) -> -35.5 | P28: of:=VALUE(LEFT([.C28];5)) -> -38.6 | Q28: of:=AVERAGE([.P28];[.R28]) -> -37.7 | R28: of:=VALUE(LEFT([.E28];5)) -> -36.8 | S28: of:=VALUE(LEFT([.F28];5)) -> -38.4 | T28: of:=VALUE(LEFT([.G28];5)) -> -41 | U28: of:=VALUE(LEFT([.H28];5)) -> -43.5 | V28: of:=VALUE(LEFT([.I28];5)) -> -43.3 | W28: of:=AVERAGE([.V28];[.X28]) -> -43.1 | X28: of:=VALUE(LEFT([.K28];5)) -> -42.9 | Y28: of:=VALUE(LEFT([.L28];5)) -> -39 | Z28: of:=VALUE(LEFT([.M28];5)) -> -35.5
A29: 1984 | B29: -32.3( 48) | C29: -38.5( 79) | D29: -37.7( 58) | E29: -42.2( 23) | F29: -43.7( 48) | G29: -47.2( 43) | H29: -46.3( 35) | I29: -44.5( 67) | J29: -43.9( 73) | K29: -42.0( 64) | L29: -40.0( 43) | M29: -35.3( 80) | N29: 1984 | O29: of:=VALUE(LEFT([.B29];5)) -> -32.3 | P29: of:=VALUE(LEFT([.C29];5)) -> -38.5 | Q29: of:=VALUE(LEFT([.D29];5)) -> -37.7 | R29: of:=VALUE(LEFT([.E29];5)) -> -42.2 | S29: of:=VALUE(LEFT([.F29];5)) -> -43.7 | T29: of:=VALUE(LEFT([.G29];5)) -> -47.2 | U29: of:=VALUE(LEFT([.H29];5)) -> -46.3 | V29: of:=VALUE(LEFT([.I29];5)) -> -44.5 | W29: of:=VALUE(LEFT([.J29];5)) -> -43.9 | X29: of:=VALUE(LEFT([.K29];5)) -> -42 | Y29: of:=VALUE(LEFT([.L29];5)) -> -40 | Z29: of:=VALUE(LEFT([.M29];5)) -> -35.3
A30: 1985 | B30: -33.5(100) | C30: -39.5( 96) | D30: -39.2( 96) | E30: -41.9( 96) | F30: -44.9( 96) | G30: -41.5(100) | H30: -45.9( 96) | I30: -42.5( 96) | J30: -43.4( 96) | K30: -41.7(100) | L30: -39.9(100) | M30: -37.7( 96) | N30: 1985 | O30: of:=VALUE(LEFT([.B30];5)) -> -33.5 | P30: of:=VALUE(LEFT([.C30];5)) -> -39.5 | Q30: of:=VALUE(LEFT([.D30];5)) -> -39.2 | R30: of:=VALUE(LEFT([.E30];5)) -> -41.9 | S30: of:=VALUE(LEFT([.F30];5)) -> -44.9 | T30: of:=VALUE(LEFT([.G30];5)) -> -41.5 | U30: of:=VALUE(LEFT([.H30];5)) -> -45.9 | V30: of:=VALUE(LEFT([.I30];5)) -> -42.5 | W30: of:=VALUE(LEFT([.J30];5)) -> -43.4 | X30: of:=VALUE(LEFT([.K30];5)) -> -41.7 | Y30: of:=VALUE(LEFT([.L30];5)) -> -39.9 | Z30: of:=VALUE(LEFT([.M30];5)) -> -37.7
A31: 1986 | B31: -32.8( 96) | C31: -35.0(100) | D31: -40.4( 96) | E31: -39.8( 96) | F31: -43.0( 90) | G31: -44.8( 96) | H31: -44.2( 96) | I31: -46.3( 96) | J31: -47.3( 96) | K31: -42.2(100) | L31: -39.2( 83) | M31: -36.5( 77) | N31: 1986 | O31: of:=VALUE(LEFT([.B31];5)) -> -32.8 | P31: of:=VALUE(LEFT([.C31];5)) -> -35 | Q31: of:=VALUE(LEFT([.D31];5)) -> -40.4 | R31: of:=VALUE(LEFT([.E31];5)) -> -39.8 | S31: of:=VALUE(LEFT([.F31];5)) -> -43 | T31: of:=VALUE(LEFT([.G31];5)) -> -44.8 | U31: of:=VALUE(LEFT([.H31];5)) -> -44.2 | V31: of:=VALUE(LEFT([.I31];5)) -> -46.3 | W31: of:=VALUE(LEFT([.J31];5)) -> -47.3 | X31: of:=VALUE(LEFT([.K31];5)) -> -42.2 | Y31: of:=VALUE(LEFT([.L31];5)) -> -39.2 | Z31: of:=VALUE(LEFT([.M31];5)) -> -36.5
A32: 1987 | B32: -31.9( 87) | C32: -36.8( 85) | D32: -38.3( 87) | E32: -41.0( 86) | F32: -41.7( 93) | G32: -40.4( 80) | H32: -44.1( 87) | I32: -46.4( 77) | J32: -42.3( 83) | K32: -41.2(100) | L32: -38.2( 96) | M32: -35.9( 96) | N32: 1987 | O32: of:=VALUE(LEFT([.B32];5)) -> -31.9 | P32: of:=VALUE(LEFT([.C32];5)) -> -36.8 | Q32: of:=VALUE(LEFT([.D32];5)) -> -38.3 | R32: of:=VALUE(LEFT([.E32];5)) -> -41 | S32: of:=VALUE(LEFT([.F32];5)) -> -41.7 | T32: of:=VALUE(LEFT([.G32];5)) -> -40.4 | U32: of:=VALUE(LEFT([.H32];5)) -> -44.1 | V32: of:=VALUE(LEFT([.I32];5)) -> -46.4 | W32: of:=VALUE(LEFT([.J32];5)) -> -42.3 | X32: of:=VALUE(LEFT([.K32];5)) -> -41.2 | Y32: of:=VALUE(LEFT([.L32];5)) -> -38.2 | Z32: of:=VALUE(LEFT([.M32];5)) -> -35.9
A33: 1988 | B33: -34.3( 96) | C33: -36.8( 96) | D33: -38.0(100) | E33: -39.2( 96) | F33: -41.7(100) | G33: -42.9(100) | H33: -43.4( 96) | I33: -41.7( 96) | J33: -41.4( 96) | K33: -40.2( 96) | L33: -38.1(100) | M33: -36.8(100) | N33: 1988 | O33: of:=VALUE(LEFT([.B33];5)) -> -34.3 | P33: of:=VALUE(LEFT([.C33];5)) -> -36.8 | Q33: of:=VALUE(LEFT([.D33];5)) -> -38 | R33: of:=VALUE(LEFT([.E33];5)) -> -39.2 | S33: of:=VALUE(LEFT([.F33];5)) -> -41.7 | T33: of:=VALUE(LEFT([.G33];5)) -> -42.9 | U33: of:=VALUE(LEFT([.H33];5)) -> -43.4 | V33: of:=VALUE(LEFT([.I33];5)) -> -41.7 | W33: of:=VALUE(LEFT([.J33];5)) -> -41.4 | X33: of:=VALUE(LEFT([.K33];5)) -> -40.2 | Y33: of:=VALUE(LEFT([.L33];5)) -> -38.1 | Z33: of:=VALUE(LEFT([.M33];5)) -> -36.8
A34: 1989 | B34: -34.6(100) | C34: -35.1( 89) | D34: -38.4( 45) | E34: -43.0( 70) | F34: -44.4( 83) | G34: -45.7( 76) | H34: -42.4( 80) | I34: -44.1( 58) | J34: -44.7( 73) | K34: -42.4( 96) | L34: -37.2(100) | M34: -34.1( 58) | N34: 1989 | O34: of:=VALUE(LEFT([.B34];5)) -> -34.6 | P34: of:=VALUE(LEFT([.C34];5)) -> -35.1 | Q34: of:=VALUE(LEFT([.D34];5)) -> -38.4 | R34: of:=VALUE(LEFT([.E34];5)) -> -43 | S34: of:=VALUE(LEFT([.F34];5)) -> -44.4 | T34: of:=VALUE(LEFT([.G34];5)) -> -45.7 | U34: of:=VALUE(LEFT([.H34];5)) -> -42.4 | V34: of:=VALUE(LEFT([.I34];5)) -> -44.1 | W34: of:=VALUE(LEFT([.J34];5)) -> -44.7 | X34: of:=VALUE(LEFT([.K34];5)) -> -42.4 | Y34: of:=VALUE(LEFT([.L34];5)) -> -37.2 | Z34: of:=VALUE(LEFT([.M34];5)) -> -34.1
A35: 1990 | B35: -34.4( 96) | C35: -37.2(100) | D35: -38.9(100) | E35: -42.3( 96) | F35: -42.7(100) | G35: -43.6(100) | H35: -42.8( 96) | I35: -45.2( 93) | J35: -43.6( 93) | K35: -40.6( 96) | L35: -30.9( 23) | M35: -33.4( 87) | N35: 1990 | O35: of:=VALUE(LEFT([.B35];5)) -> -34.4 | P35: of:=VALUE(LEFT([.C35];5)) -> -37.2 | Q35: of:=VALUE(LEFT([.D35];5)) -> -38.9 | R35: of:=VALUE(LEFT([.E35];5)) -> -42.3 | S35: of:=VALUE(LEFT([.F35];5)) -> -42.7 | T35: of:=VALUE(LEFT([.G35];5)) -> -43.6 | U35: of:=VALUE(LEFT([.H35];5)) -> -42.8 | V35: of:=VALUE(LEFT([.I35];5)) -> -45.2 | W35: of:=VALUE(LEFT([.J35];5)) -> -43.6 | X35: of:=VALUE(LEFT([.K35];5)) -> -40.6 | Y35: of:=VALUE(LEFT([.L35];5)) -> -30.9 | Z35: of:=VALUE(LEFT([.M35];5)) -> -33.4
A36: 1991 | B36: -33.2( 67) | C36: -36.0( 60) | D36: -41.5( 48) | E36: -40.9( 60) | F36: -45.2( 74) | G36: -42.2( 53) | H36: -43.3( 67) | I36: -42.0( 22) | J36: -38.9( 36) | K36: -41.7( 38) | L36: - | M36: -31.8( 22) | N36: 1991 | O36: of:=VALUE(LEFT([.B36];5)) -> -33.2 | P36: of:=VALUE(LEFT([.C36];5)) -> -36 | Q36: of:=VALUE(LEFT([.D36];5)) -> -41.5 | R36: of:=VALUE(LEFT([.E36];5)) -> -40.9 | S36: of:=VALUE(LEFT([.F36];5)) -> -45.2 | T36: of:=VALUE(LEFT([.G36];5)) -> -42.2 | U36: of:=VALUE(LEFT([.H36];5)) -> -43.3 | V36: of:=VALUE(LEFT([.I36];5)) -> -42 | W36: of:=VALUE(LEFT([.J36];5)) -> -38.9 | X36: of:=VALUE(LEFT([.K36];5)) -> -41.7 | Y36: of:=AVERAGE([.X36];[.Z36]) -> -36.75 | Z36: of:=VALUE(LEFT([.M36];5)) -> -31.8
A37: 1992 | B37: -34.7( 83) | C37: -36.5( 79) | D37: -40.8( 77) | E37: -40.9( 70) | F37: -41.9( 70) | G37: -42.6( 76) | H37: -41.8( 67) | I37: -45.1( 77) | J37: -45.5( 93) | K37: -40.3( 90) | L37: -38.9( 83) | M37: -35.9( 93) | N37: 1992 | O37: of:=VALUE(LEFT([.B37];5)) -> -34.7 | P37: of:=VALUE(LEFT([.C37];5)) -> -36.5 | Q37: of:=VALUE(LEFT([.D37];5)) -> -40.8 | R37: of:=VALUE(LEFT([.E37];5)) -> -40.9 | S37: of:=VALUE(LEFT([.F37];5)) -> -41.9 | T37: of:=VALUE(LEFT([.G37];5)) -> -42.6 | U37: of:=VALUE(LEFT([.H37];5)) -> -41.8 | V37: of:=VALUE(LEFT([.I37];5)) -> -45.1 | W37: of:=VALUE(LEFT([.J37];5)) -> -45.5 | X37: of:=VALUE(LEFT([.K37];5)) -> -40.3 | Y37: of:=VALUE(LEFT([.L37];5)) -> -38.9 | Z37: of:=VALUE(LEFT([.M37];5)) -> -35.9
A38: 1993 | B38: -33.6( 90) | C38: -37.9( 89) | D38: -40.6( 83) | E38: -41.9( 96) | F38: -43.6( 93) | G38: -43.9( 83) | H38: -42.8( 80) | I38: -45.6( 96) | J38: -42.5( 83) | K38: -42.5( 90) | L38: -38.4( 80) | M38: -36.8( 90) | N38: 1993 | O38: of:=VALUE(LEFT([.B38];5)) -> -33.6 | P38: of:=VALUE(LEFT([.C38];5)) -> -37.9 | Q38: of:=VALUE(LEFT([.D38];5)) -> -40.6 | R38: of:=VALUE(LEFT([.E38];5)) -> -41.9 | S38: of:=VALUE(LEFT([.F38];5)) -> -43.6 | T38: of:=VALUE(LEFT([.G38];5)) -> -43.9 | U38: of:=VALUE(LEFT([.H38];5)) -> -42.8 | V38: of:=VALUE(LEFT([.I38];5)) -> -45.6 | W38: of:=VALUE(LEFT([.J38];5)) -> -42.5 | X38: of:=VALUE(LEFT([.K38];5)) -> -42.5 | Y38: of:=VALUE(LEFT([.L38];5)) -> -38.4 | Z38: of:=VALUE(LEFT([.M38];5)) -> -36.8
A39: 1994 | B39: -35.0( 41) | C39: -37.4( 42) | D39: -39.8( 45) | E39: -41.1( 23) | F39: -45.9( 29) | G39: -40.8( 26) | H39: -45.5( 16) | I39: -43.4( 32) | J39: -42.5( 20) | K39: -42.1( 45) | L39: -38.6( 53) | M39: -37.3( 45) | N39: 1994 | O39: of:=VALUE(LEFT([.B39];5)) -> -35 | P39: of:=VALUE(LEFT([.C39];5)) -> -37.4 | Q39: of:=VALUE(LEFT([.D39];5)) -> -39.8 | R39: of:=VALUE(LEFT([.E39];5)) -> -41.1 | S39: of:=VALUE(LEFT([.F39];5)) -> -45.9 | T39: of:=VALUE(LEFT([.G39];5)) -> -40.8 | U39: of:=VALUE(LEFT([.H39];5)) -> -45.5 | V39: of:=VALUE(LEFT([.I39];5)) -> -43.4 | W39: of:=VALUE(LEFT([.J39];5)) -> -42.5 | X39: of:=VALUE(LEFT([.K39];5)) -> -42.1 | Y39: of:=VALUE(LEFT([.L39];5)) -> -38.6 | Z39: of:=VALUE(LEFT([.M39];5)) -> -37.3
A40: 1995 | B40: -36.5( 45) | C40: -37.4( 75) | D40: - | E40: -43.2( 60) | F40: -45.0( 48) | G40: -43.0( 63) | H40: -44.2( 74) | I40: -45.5( 48) | J40: -47.2( 10) | K40: -42.5( 35) | L40: -37.5( 33) | M40: -35.1( 67) | N40: 1995 | O40: of:=VALUE(LEFT([.B40];5)) -> -36.5 | P40: of:=VALUE(LEFT([.C40];5)) -> -37.4 | Q40: of:=AVERAGE([.P40];[.R40]) -> -40.3 | R40: of:=VALUE(LEFT([.E40];5)) -> -43.2 | S40: of:=VALUE(LEFT([.F40];5)) -> -45 | T40: of:=VALUE(LEFT([.G40];5)) -> -43 | U40: of:=VALUE(LEFT([.H40];5)) -> -44.2 | V40: of:=VALUE(LEFT([.I40];5)) -> -45.5 | W40: of:=VALUE(LEFT([.J40];5)) -> -47.2 | X40: of:=VALUE(LEFT([.K40];5)) -> -42.5 | Y40: of:=VALUE(LEFT([.L40];5)) -> -37.5 | Z40: of:=VALUE(LEFT([.M40];5)) -> -35.1
A41: 1996 | B41: -34.7( 90) | C41: -35.1( 96) | D41: -39.3( 93) | E41: -38.8(100) | F41: -43.3( 96) | G41: -43.0( 96) | H41: -44.1(100) | I41: -39.7(100) | J41: -43.3( 96) | K41: -42.0(100) | L41: -36.6( 83) | M41: -35.0(100) | N41: 1996 | O41: of:=VALUE(LEFT([.B41];5)) -> -34.7 | P41: of:=VALUE(LEFT([.C41];5)) -> -35.1 | Q41: of:=VALUE(LEFT([.D41];5)) -> -39.3 | R41: of:=VALUE(LEFT([.E41];5)) -> -38.8 | S41: of:=VALUE(LEFT([.F41];5)) -> -43.3 | T41: of:=VALUE(LEFT([.G41];5)) -> -43 | U41: of:=VALUE(LEFT([.H41];5)) -> -44.1 | V41: of:=VALUE(LEFT([.I41];5)) -> -39.7 | W41: of:=VALUE(LEFT([.J41];5)) -> -43.3 | X41: of:=VALUE(LEFT([.K41];5)) -> -42 | Y41: of:=VALUE(LEFT([.L41];5)) -> -36.6 | Z41: of:=VALUE(LEFT([.M41];5)) -> -35
A42: 1997 | B42: -35.3(100) | C42: -39.4( 92) | D42: -40.0(100) | E42: -42.9(100) | F42: -41.9(100) | G42: -42.8( 93) | H42: -46.0(100) | I42: -44.7( 96) | J42: -44.8(100) | K42: -42.0( 96) | L42: -35.9(100) | M42: -36.1( 83) | N42: 1997 | O42: of:=VALUE(LEFT([.B42];5)) -> -35.3 | P42: of:=VALUE(LEFT([.C42];5)) -> -39.4 | Q42: of:=VALUE(LEFT([.D42];5)) -> -40 | R42: of:=VALUE(LEFT([.E42];5)) -> -42.9 | S42: of:=VALUE(LEFT([.F42];5)) -> -41.9 | T42: of:=VALUE(LEFT([.G42];5)) -> -42.8 | U42: of:=VALUE(LEFT([.H42];5)) -> -46 | V42: of:=VALUE(LEFT([.I42];5)) -> -44.7 | W42: of:=VALUE(LEFT([.J42];5)) -> -44.8 | X42: of:=VALUE(LEFT([.K42];5)) -> -42 | Y42: of:=VALUE(LEFT([.L42];5)) -> -35.9 | Z42: of:=VALUE(LEFT([.M42];5)) -> -36.1
A43: 1998 | B43: -33.6(100) | C43: -34.2(100) | D43: -39.1( 96) | E43: -44.0( 93) | F43: -41.6( 96) | G43: -40.1( 96) | H43: -44.2( 96) | I43: -44.6(100) | J43: -44.9(100) | K43: -41.9( 96) | L43: -38.1( 90) | M43: -35.2(100) | N43: 1998 | O43: of:=VALUE(LEFT([.B43];5)) -> -33.6 | P43: of:=VALUE(LEFT([.C43];5)) -> -34.2 | Q43: of:=VALUE(LEFT([.D43];5)) -> -39.1 | R43: of:=VALUE(LEFT([.E43];5)) -> -44 | S43: of:=VALUE(LEFT([.F43];5)) -> -41.6 | T43: of:=VALUE(LEFT([.G43];5)) -> -40.1 | U43: of:=VALUE(LEFT([.H43];5)) -> -44.2 | V43: of:=VALUE(LEFT([.I43];5)) -> -44.6 | W43: of:=VALUE(LEFT([.J43];5)) -> -44.9 | X43: of:=VALUE(LEFT([.K43];5)) -> -41.9 | Y43: of:=VALUE(LEFT([.L43];5)) -> -38.1 | Z43: of:=VALUE(LEFT([.M43];5)) -> -35.2
A44: 1999 | B44: -30.2(100) | C44: -36.3( 96) | D44: -38.7( 96) | E44: -43.3( 96) | F44: -41.8( 90) | G44: -41.8( 96) | H44: -43.2( 87) | I44: -43.2( 96) | J44: -41.9( 96) | K44: -39.3(100) | L44: -37.9( 96) | M44: -36.4(100) | N44: 1999 | O44: of:=VALUE(LEFT([.B44];5)) -> -30.2 | P44: of:=VALUE(LEFT([.C44];5)) -> -36.3 | Q44: of:=VALUE(LEFT([.D44];5)) -> -38.7 | R44: of:=VALUE(LEFT([.E44];5)) -> -43.3 | S44: of:=VALUE(LEFT([.F44];5)) -> -41.8 | T44: of:=VALUE(LEFT([.G44];5)) -> -41.8 | U44: of:=VALUE(LEFT([.H44];5)) -> -43.2 | V44: of:=VALUE(LEFT([.I44];5)) -> -43.2 | W44: of:=VALUE(LEFT([.J44];5)) -> -41.9 | X44: of:=VALUE(LEFT([.K44];5)) -> -39.3 | Y44: of:=VALUE(LEFT([.L44];5)) -> -37.9 | Z44: of:=VALUE(LEFT([.M44];5)) -> -36.4
A45: 2000 | B45: -35.4(100) | C45: -36.8( 96) | D45: -38.8( 96) | E45: -42.1(100) | F45: -42.4(100) | G45: -40.5(100) | H45: -43.5(100) | I45: -43.7( 93) | J45: -44.0( 93) | K45: -41.7(100) | L45: -35.3(100) | M45: -35.2( 96) | N45: 2000 | O45: of:=VALUE(LEFT([.B45];5)) -> -35.4 | P45: of:=VALUE(LEFT([.C45];5)) -> -36.8 | Q45: of:=VALUE(LEFT([.D45];5)) -> -38.8 | R45: of:=VALUE(LEFT([.E45];5)) -> -42.1 | S45: of:=VALUE(LEFT([.F45];5)) -> -42.4 | T45: of:=VALUE(LEFT([.G45];5)) -> -40.5 | U45: of:=VALUE(LEFT([.H45];5)) -> -43.5 | V45: of:=VALUE(LEFT([.I45];5)) -> -43.7 | W45: of:=VALUE(LEFT([.J45];5)) -> -44 | X45: of:=VALUE(LEFT([.K45];5)) -> -41.7 | Y45: of:=VALUE(LEFT([.L45];5)) -> -35.3 | Z45: of:=VALUE(LEFT([.M45];5)) -> -35.2
A46: 2001 | B46: -34.3( 96) | C46: -34.6( 92) | D46: -40.0( 90) | E46: -41.0( 93) | F46: -41.7( 80) | G46: -43.0( 93) | H46: -43.4( 87) | I46: -45.0( 93) | J46: -40.7( 93) | K46: -41.8(100) | L46: -37.0(100) | M46: -33.4(100) | N46: 2001 | O46: of:=VALUE(LEFT([.B46];5)) -> -34.3 | P46: of:=VALUE(LEFT([.C46];5)) -> -34.6 | Q46: of:=VALUE(LEFT([.D46];5)) -> -40 | R46: of:=VALUE(LEFT([.E46];5)) -> -41 | S46: of:=VALUE(LEFT([.F46];5)) -> -41.7 | T46: of:=VALUE(LEFT([.G46];5)) -> -43 | U46: of:=VALUE(LEFT([.H46];5)) -> -43.4 | V46: of:=VALUE(LEFT([.I46];5)) -> -45 | W46: of:=VALUE(LEFT([.J46];5)) -> -40.7 | X46: of:=VALUE(LEFT([.K46];5)) -> -41.8 | Y46: of:=VALUE(LEFT([.L46];5)) -> -37 | Z46: of:=VALUE(LEFT([.M46];5)) -> -33.4
A47: 2002 | B47: -32.7(100) | C47: -36.2(100) | D47: -38.1(100) | E47: -39.7(100) | F47: -40.0( 93) | G47: -43.0(100) | H47: -42.0( 96) | I47: -44.4(100) | J47: -40.7(100) | K47: -40.0( 93) | L47: -39.8( 96) | M47: -36.9( 96) | N47: 2002 | O47: of:=VALUE(LEFT([.B47];5)) -> -32.7 | P47: of:=VALUE(LEFT([.C47];5)) -> -36.2 | Q47: of:=VALUE(LEFT([.D47];5)) -> -38.1 | R47: of:=VALUE(LEFT([.E47];5)) -> -39.7 | S47: of:=VALUE(LEFT([.F47];5)) -> -40 | T47: of:=VALUE(LEFT([.G47];5)) -> -43 | U47: of:=VALUE(LEFT([.H47];5)) -> -42 | V47: of:=VALUE(LEFT([.I47];5)) -> -44.4 | W47: of:=VALUE(LEFT([.J47];5)) -> -40.7 | X47: of:=VALUE(LEFT([.K47];5)) -> -40 | Y47: of:=VALUE(LEFT([.L47];5)) -> -39.8 | Z47: of:=VALUE(LEFT([.M47];5)) -> -36.9
A48: 2003 | B48: -32.8( 96) | C48: -35.1( 96) | D48: -39.8(100) | E48: -39.5( 96) | F48: -40.8(100) | G48: -43.9( 96) | H48: -43.6(100) | I48: -42.5(100) | J48: -43.6( 96) | K48: -41.0( 96) | L48: -38.8(100) | M48: -34.1(100) | N48: 2003 | O48: of:=VALUE(LEFT([.B48];5)) -> -32.8 | P48: of:=VALUE(LEFT([.C48];5)) -> -35.1 | Q48: of:=VALUE(LEFT([.D48];5)) -> -39.8 | R48: of:=VALUE(LEFT([.E48];5)) -> -39.5 | S48: of:=VALUE(LEFT([.F48];5)) -> -40.8 | T48: of:=VALUE(LEFT([.G48];5)) -> -43.9 | U48: of:=VALUE(LEFT([.H48];5)) -> -43.6 | V48: of:=VALUE(LEFT([.I48];5)) -> -42.5 | W48: of:=VALUE(LEFT([.J48];5)) -> -43.6 | X48: of:=VALUE(LEFT([.K48];5)) -> -41 | Y48: of:=VALUE(LEFT([.L48];5)) -> -38.8 | Z48: of:=VALUE(LEFT([.M48];5)) -> -34.1
A49: 2004 | B49: -33.1(100) | C49: -35.7(100) | D49: -38.4(100) | E49: -38.6(100) | F49: -41.0(100) | G49: -42.5(100) | H49: -47.9( 96) | I49: -45.6( 96) | J49: -42.3(100) | K49: -40.9( 96) | L49: -40.1( 76) | M49: -34.9(100) | N49: 2004 | O49: of:=VALUE(LEFT([.B49];5)) -> -33.1 | P49: of:=VALUE(LEFT([.C49];5)) -> -35.7 | Q49: of:=VALUE(LEFT([.D49];5)) -> -38.4 | R49: of:=VALUE(LEFT([.E49];5)) -> -38.6 | S49: of:=VALUE(LEFT([.F49];5)) -> -41 | T49: of:=VALUE(LEFT([.G49];5)) -> -42.5 | U49: of:=VALUE(LEFT([.H49];5)) -> -47.9 | V49: of:=VALUE(LEFT([.I49];5)) -> -45.6 | W49: of:=VALUE(LEFT([.J49];5)) -> -42.3 | X49: of:=VALUE(LEFT([.K49];5)) -> -40.9 | Y49: of:=VALUE(LEFT([.L49];5)) -> -40.1 | Z49: of:=VALUE(LEFT([.M49];5)) -> -34.9
A50: 2005 | B50: -32.1(100) | C50: -35.6(100) | D50: -37.9(100) | E50: -40.6(100) | F50: -42.1(100) | G50: -43.2(100) | H50: -44.0(100) | I50: -46.2(100) | J50: -41.4(100) | K50: -40.6(100) | L50: -40.1(100) | M50: -33.3(100) | N50: 2005 | O50: of:=VALUE(LEFT([.B50];5)) -> -32.1 | P50: of:=VALUE(LEFT([.C50];5)) -> -35.6 | Q50: of:=VALUE(LEFT([.D50];5)) -> -37.9 | R50: of:=VALUE(LEFT([.E50];5)) -> -40.6 | S50: of:=VALUE(LEFT([.F50];5)) -> -42.1 | T50: of:=VALUE(LEFT([.G50];5)) -> -43.2 | U50: of:=VALUE(LEFT([.H50];5)) -> -44 | V50: of:=VALUE(LEFT([.I50];5)) -> -46.2 | W50: of:=VALUE(LEFT([.J50];5)) -> -41.4 | X50: of:=VALUE(LEFT([.K50];5)) -> -40.6 | Y50: of:=VALUE(LEFT([.L50];5)) -> -40.1 | Z50: of:=VALUE(LEFT([.M50];5)) -> -33.3
A51: 2006 | B51: -35.2(100) | C51: -36.1(100) | D51: -38.7(100) | E51: -40.5(100) | F51: -44.4(100) | G51: -43.3(100) | H51: -45.2(100) | I51: -42.1(100) | J51: -43.4(100) | K51: -42.3(100) | L51: -37.1(100) | M51: -38.9(100) | N51: 2006 | O51: of:=VALUE(LEFT([.B51];5)) -> -35.2 | P51: of:=VALUE(LEFT([.C51];5)) -> -36.1 | Q51: of:=VALUE(LEFT([.D51];5)) -> -38.7 | R51: of:=VALUE(LEFT([.E51];5)) -> -40.5 | S51: of:=VALUE(LEFT([.F51];5)) -> -44.4 | T51: of:=VALUE(LEFT([.G51];5)) -> -43.3 | U51: of:=VALUE(LEFT([.H51];5)) -> -45.2 | V51: of:=VALUE(LEFT([.I51];5)) -> -42.1 | W51: of:=VALUE(LEFT([.J51];5)) -> -43.4 | X51: of:=VALUE(LEFT([.K51];5)) -> -42.3 | Y51: of:=VALUE(LEFT([.L51];5)) -> -37.1 | Z51: of:=VALUE(LEFT([.M51];5)) -> -38.9
A52: 2007 | B52: -32.7( 96) | C52: -38.3(100) | D52: -40.3(100) | E52: -41.9(100) | F52: -40.8(100) | G52: -41.2(100) | H52: -43.4(100) | I52: -45.0(100) | J52: -44.3(100) | K52: -41.8(100) | L52: -38.6(100) | M52: -36.0(100) | N52: 2007 | O52: of:=VALUE(LEFT([.B52];5)) -> -32.7 | P52: of:=VALUE(LEFT([.C52];5)) -> -38.3 | Q52: of:=VALUE(LEFT([.D52];5)) -> -40.3 | R52: of:=VALUE(LEFT([.E52];5)) -> -41.9 | S52: of:=VALUE(LEFT([.F52];5)) -> -40.8 | T52: of:=VALUE(LEFT([.G52];5)) -> -41.2 | U52: of:=VALUE(LEFT([.H52];5)) -> -43.4 | V52: of:=VALUE(LEFT([.I52];5)) -> -45 | W52: of:=VALUE(LEFT([.J52];5)) -> -44.3 | X52: of:=VALUE(LEFT([.K52];5)) -> -41.8 | Y52: of:=VALUE(LEFT([.L52];5)) -> -38.6 | Z52: of:=VALUE(LEFT([.M52];5)) -> -36
A53: 2008 | B53: -36.3(100) | C53: -38.2( 96) | D53: -38.6( 96) | E53: -38.6( 96) | F53: -42.3(100) | G53: -43.2(100) | H53: -43.9( 96) | I53: -46.3(100) | J53: -41.8(100) | K53: -41.5(100) | L53: -39.6(100) | M53: -36.6(100) | N53: 2008 | O53: of:=VALUE(LEFT([.B53];5)) -> -36.3 | P53: of:=VALUE(LEFT([.C53];5)) -> -38.2 | Q53: of:=VALUE(LEFT([.D53];5)) -> -38.6 | R53: of:=VALUE(LEFT([.E53];5)) -> -38.6 | S53: of:=VALUE(LEFT([.F53];5)) -> -42.3 | T53: of:=VALUE(LEFT([.G53];5)) -> -43.2 | U53: of:=VALUE(LEFT([.H53];5)) -> -43.9 | V53: of:=VALUE(LEFT([.I53];5)) -> -46.3 | W53: of:=VALUE(LEFT([.J53];5)) -> -41.8 | X53: of:=VALUE(LEFT([.K53];5)) -> -41.5 | Y53: of:=VALUE(LEFT([.L53];5)) -> -39.6 | Z53: of:=VALUE(LEFT([.M53];5)) -> -36.6
A54: 2009 | B54: -35.0(100) | C54: -38.0(100) | D54: -39.1(100) | E54: -42.3(100) | F54: -40.7(100) | G54: -41.6( 96) | H54: -42.9(100) | I54: -45.3(100) | J54: -42.8(100) | K54: -41.9( 93) | L54: - | M54: - | N54: 2009 | O54: of:=VALUE(LEFT([.B54];5)) -> -35 | P54: of:=VALUE(LEFT([.C54];5)) -> -38 | Q54: of:=VALUE(LEFT([.D54];5)) -> -39.1 | R54: of:=VALUE(LEFT([.E54];5)) -> -42.3 | S54: of:=VALUE(LEFT([.F54];5)) -> -40.7 | T54: of:=VALUE(LEFT([.G54];5)) -> -41.6 | U54: of:=VALUE(LEFT([.H54];5)) -> -42.9 | V54: of:=VALUE(LEFT([.I54];5)) -> -45.3 | W54: of:=VALUE(LEFT([.J54];5)) -> -42.8 | X54: of:=VALUE(LEFT([.K54];5)) -> -41.9
A55: Click here to download a text version of the above table

Sheet: local-table
B1: Jan | C1: Feb | D1: Mar | E1: Apr | F1: May | G1: Jun | H1: Jul | I1: Aug | J1: Sep | K1: Oct | L1: Nov | M1: Dec
A2: 1 | B2: -36.1 | C2: -36.6 | D2: -41 | E2: -40.6 | F2: -40.9 | G2: -41.5 | H2: -46.4 | I2: -44.1 | J2: -42.9 | K2: -42.2 | L2: -39.1 | M2: -39.1
A3: 2 | B3: -37.1 | C3: -37.2 | D3: -41.7 | E3: -41.5 | F3: -42.7 | G3: -43.1 | H3: -45.7 | I3: -45.4 | J3: -43.4 | K3: -43 | L3: -39.8 | M3: -38.5
A4: 3 | B4: -35.3 | C4: -38.4 | D4: -40.5 | E4: -43.4 | F4: -43 | G4: -42.1 | H4: -44 | I4: -44.2 | J4: -43.6 | K4: -42.8 | L4: -40.5 | M4: -36.8
A5: 4 | B5: -35.3 | C5: -38.4 | D5: -41.5 | E5: -43.8 | F5: -47.1 | G5: -42.9 | H5: -43.4 | I5: -46 | J5: -45.3 | K5: -43.2 | L5: -40.1 | M5: -37.9
A6: 5 | B6: -35.3 | C6: -38.4 | D6: -41.5 | E6: -43.8 | F6: -47.1 | G6: -42.9 | H6: -43.4 | I6: -46 | J6: -45.3 | K6: -43.2 | L6: -40.1 | M6: -37.9
A7: 6 | B7: -36.8 | C7: -36.7 | D7: -40.5 | E7: -41.5 | F7: -44.1 | G7: -43.8 | H7: -44.8 | I7: -44.9 | J7: -45.5 | K7: -42.1 | L7: -40.1 | M7: -36.6
A8: 7 | B8: -35.6 | C8: -36.8 | D8: -38.4 | E8: -42.4 | F8: -44.4 | G8: -43.6 | H8: -44.5 | I8: -47 | J8: -44.7 | K8: -43.1 | L8: -38.6 | M8: -35.1
A9: 8 | B9: -31.7 | C9: -35.7 | D9: -41.4 | E9: -45.2 | F9: -42.1 | G9: -42.8 | H9: -44.1 | I9: -44.1 | J9: -43.4 | K9: -44 | L9: -38.8 | M9: -35.6
A10: 9 | B10: -35.7 | C10: -36 | D10: -38.9 | E10: -41.4 | F10: -42.9 | G10: -45.2 | H10: -44.4 | I10: -45.7 | J10: -46.8 | K10: -40.6 | L10: -38.8 | M10: -37.5
A11: 10 | B11: -35.2 | C11: -39.5 | D11: -41.2 | E11: -41.2 | F11: -42.4 | G11: -44.9 | H11: -47.7 | I11: -45.5 | J11: -43.8 | K11: -40.5 | L11: -40.3 | M11: -37.2
A12: 11 | B12: -33.9 | C12: -37.4 | D12: -40.8 | E12: -41.3 | F12: -45 | G12: -43.1 | H12: -44.2 | I12: -47.2 | J12: -44.2 | K12: -40.8 | L12: -40.6 | M12: -36.3
A13: 12 | B13: -32.4 | C13: -36.8 | D13: -39.9 | E13: -40.6 | F13: -42 | G13: -45.1 | H13: -45.8 | I13: -44.4 | J13: -45 | K13: -41.9 | L13: -38.4 | M13: -35
A14: 13 | B14: -34.2 | C14: -37.4 | D14: -40.3 | E14: -42.9 | F14: -42.4 | G14: -43.1 | H14: -44.6 | I14: -42.8 | J14: -44.1 | K14: -41.9 | L14: -38.7 | M14: -36.8
A15: 14 | B15: -35.1 | C15: -40.1 | D15: -42 | E15: -43.4 | F15: -42 | G15: -45.6 | H15: -44.9 | I15: -44.7 | J15: -43.8 | K15: -41.4 | L15: -37.4 | M15: -38.6
A16: 15 | B16: -34.9 | C16: -38 | D16: -40.7 | E16: -42.3 | F16: -44.2 | G16: -41.1 | H16: -44.5 | I16: -44.6 | J16: -44.4 | K16: -41.8 | L16: -38.1 | M16: -34.6
A17: 16 | B17: -35.8 | C17: -35.7 | D17: -39.4 | E17: -42.3 | F17: -42.7 | G17: -45.3 | H17: -47.5 | I17: -45.9 | J17: -44.6 | K17: -43 | L17: -39.4 | M17: -35.1
A18: 17 | B18: -34.4 | C18: -36.8 | D18: -40 | E18: -43.7 | F18: -44 | G18: -44.2 | H18: -45.2 | I18: -45.5 | J18: -44.2 | K18: -45.9 | L18: -40.2 | M18: -34.4
A19: 18 | B19: -32.2 | C19: -38.3 | D19: -40.5 | E19: -42.7 | F19: -40.7 | G19: -43.1 | H19: -44.5 | I19: -44.4 | J19: -46.6 | K19: -43.9 | L19: -41.2 | M19: -38.2
A20: 19 | B20: -36.6 | C20: -36.8 | D20: -40.5 | E20: -40.7 | F20: -42.6 | G20: -43.9 | H20: -44.9 | I20: -47 | J20: -42.2 | K20: -41.6 | L20: -38.1 | M20: -35.4
A21: 20 | B21: -33 | C21: -36.8 | D21: -37.6 | E21: -38.1 | F21: -43.1 | G21: -42.1 | H21: -44.8 | I21: -46.1 | J21: -42.8 | K21: -42.8 | L21: -38.7 | M21: -36
A22: 21 | B22: -33.9 | C22: -36 | D22: -40.4 | E22: -41 | F22: -41.1 | G22: -42.4 | H22: -44 | I22: -42.7 | J22: -41.9 | K22: -41.7 | L22: -36.5 | M22: -35.6
A23: 22 | B23: -33.8 | C23: -35.9 | D23: -36.8 | E23: -43 | F23: -40.1 | G23: -43.7 | H23: -41.8 | I23: -42 | J23: -44 | K23: -40.3 | L23: -39.4 | M23: -33.5
A24: 23 | B24: -33.9 | C24: -36.6 | D24: -43.4 | E24: -40.2 | F24: -42.6 | G24: -44.6 | H24: -45.8 | I24: -44.4 | J24: -44.2 | K24: -43.7 | L24: -34.3 | M24: -35.6
A25: 24 | B25: -35.5 | C25: -38.6 | D25: -37.7 | E25: -36.8 | F25: -38.4 | G25: -41 | H25: -43.5 | I25: -43.3 | J25: -43.1 | K25: -42.9 | L25: -39 | M25: -35.5
A26: 25 | B26: -32.3 | C26: -38.5 | D26: -37.7 | E26: -42.2 | F26: -43.7 | G26: -47.2 | H26: -46.3 | I26: -44.5 | J26: -43.9 | K26: -42 | L26: -40 | M26: -35.3
A27: 26 | B27: -33.5 | C27: -39.5 | D27: -39.2 | E27: -41.9 | F27: -44.9 | G27: -41.5 | H27: -45.9 | I27: -42.5 | J27: -43.4 | K27: -41.7 | L27: -39.9 | M27: -37.7
A28: 27 | B28: -32.8 | C28: -35 | D28: -40.4 | E28: -39.8 | F28: -43 | G28: -44.8 | H28: -44.2 | I28: -46.3 | J28: -47.3 | K28: -42.2 | L28: -39.2 | M28: -36.5
A29: 28 | B29: -31.9 | C29: -36.8 | D29: -38.3 | E29: -41 | F29: -41.7 | G29: -40.4 | H29: -44.1 | I29: -46.4 | J29: -42.3 | K29: -41.2 | L29: -38.2 | M29: -35.9
A30: 29 | B30: -34.3 | C30: -36.8 | D30: -38 | E30: -39.2 | F30: -41.7 | G30: -42.9 | H30: -43.4 | I30: -41.7 | J30: -41.4 | K30: -40.2 | L30: -38.1 | M30: -36.8
A31: 30 | B31: -34.6 | C31: -35.1 | D31: -38.4 | E31: -43 | F31: -44.4 | G31: -45.7 | H31: -42.4 | I31: -44.1 | J31: -44.7 | K31: -42.4 | L31: -37.2 | M31: -34.1
A32: 31 | B32: -34.4 | C32: -37.2 | D32: -38.9 | E32: -42.3 | F32: -42.7 | G32: -43.6 | H32: -42.8 | I32: -45.2 | J32: -43.6 | K32: -40.6 | L32: -30.9 | M32: -33.4
A33: 32 | B33: -33.2 | C33: -36 | D33: -41.5 | E33: -40.9 | F33: -45.2 | G33: -42.2 | H33: -43.3 | I33: -42 | J33: -38.9 | K33: -41.7 | L33: -36.75 | M33: -31.8
A34: 33 | B34: -34.7 | C34: -36.5 | D34: -40.8 | E34: -40.9 | F34: -41.9 | G34: -42.6 | H34: -41.8 | I34: -45.1 | J34: -45.5 | K34: -40.3 | L34: -38.9 | M34: -35.9
A35: 34 | B35: -33.6 | C35: -37.9 | D35: -40.6 | E35: -41.9 | F35: -43.6 | G35: -43.9 | H35: -42.8 | I35: -45.6 | J35: -42.5 | K35: -42.5 | L35: -38.4 | M35: -36.8
A36: 35 | B36: -35 | C36: -37.4 | D36: -39.8 | E36: -41.1 | F36: -45.9 | G36: -40.8 | H36: -45.5 | I36: -43.4 | J36: -42.5 | K36: -42.1 | L36: -38.6 | M36: -37.3
A37: 36 | B37: -36.5 | C37: -37.4 | D37: -40.3 | E37: -43.2 | F37: -45 | G37: -43 | H37: -44.2 | I37: -45.5 | J37: -47.2 | K37: -42.5 | L37: -37.5 | M37: -35.1
A38: 37 | B38: -34.7 | C38: -35.1 | D38: -39.3 | E38: -38.8 | F38: -43.3 | G38: -43 | H38: -44.1 | I38: -39.7 | J38: -43.3 | K38: -42 | L38: -36.6 | M38: -35
A39: 38 | B39: -35.3 | C39: -39.4 | D39: -40 | E39: -42.9 | F39: -41.9 | G39: -42.8 | H39: -46 | I39: -44.7 | J39: -44.8 | K39: -42 | L39: -35.9 | M39: -36.1
A40: 39 | B40: -33.6 | C40: -34.2 | D40: -39.1 | E40: -44 | F40: -41.6 | G40: -40.1 | H40: -44.2 | I40: -44.6 | J40: -44.9 | K40: -41.9 | L40: -38.1 | M40: -35.2
A41: 40 | B41: -30.2 | C41: -36.3 | D41: -38.7 | E41: -43.3 | F41: -41.8 | G41: -41.8 | H41: -43.2 | I41: -43.2 | J41: -41.9 | K41: -39.3 | L41: -37.9 | M41: -36.4
A42: 41 | B42: -35.4 | C42: -36.8 | D42: -38.8 | E42: -42.1 | F42: -42.4 | G42: -40.5 | H42: -43.5 | I42: -43.7 | J42: -44 | K42: -41.7 | L42: -35.3 | M42: -35.2
A43: 42 | B43: -34.3 | C43: -34.6 | D43: -40 | E43: -41 | F43: -41.7 | G43: -43 | H43: -43.4 | I43: -45 | J43: -40.7 | K43: -41.8 | L43: -37 | M43: -33.4
A44: 43 | B44: -32.7 | C44: -36.2 | D44: -38.1 | E44: -39.7 | F44: -40 | G44: -43 | H44: -42 | I44: -44.4 | J44: -40.7 | K44: -40 | L44: -39.8 | M44: -36.9
A45: 44 | B45: -32.8 | C45: -35.1 | D45: -39.8 | E45: -39.5 | F45: -40.8 | G45: -43.9 | H45: -43.6 | I45: -42.5 | J45: -43.6 | K45: -41 | L45: -38.8 | M45: -34.1
A46: 45 | B46: -33.1 | C46: -35.7 | D46: -38.4 | E46: -38.6 | F46: -41 | G46: -42.5 | H46: -47.9 | I46: -45.6 | J46: -42.3 | K46: -40.9 | L46: -40.1 | M46: -34.9
A47: 46 | B47: -32.1 | C47: -35.6 | D47: -37.9 | E47: -40.6 | F47: -42.1 | G47: -43.2 | H47: -44 | I47: -46.2 | J47: -41.4 | K47: -40.6 | L47: -40.1 | M47: -33.3
A48: 47 | B48: -35.2 | C48: -36.1 | D48: -38.7 | E48: -40.5 | F48: -44.4 | G48: -43.3 | H48: -45.2 | I48: -42.1 | J48: -43.4 | K48: -42.3 | L48: -37.1 | M48: -38.9
A49: 48 | B49: -32.7 | C49: -38.3 | D49: -40.3 | E49: -41.9 | F49: -40.8 | G49: -41.2 | H49: -43.4 | I49: -45 | J49: -44.3 | K49: -41.8 | L49: -38.6 | M49: -36
A50: 49 | B50: -36.3 | C50: -38.2 | D50: -38.6 | E50: -38.6 | F50: -42.3 | G50: -43.2 | H50: -43.9 | I50: -46.3 | J50: -41.8 | K50: -41.5 | L50: -39.6 | M50: -36.6
A51: 50 | B51: -35 | C51: -38 | D51: -39.1 | E51: -42.3 | F51: -40.7 | G51: -41.6 | H51: -42.9 | I51: -45.3 | J51: -42.8 | K51: -41.9 | L51: NaN | M51: NaN